{
  "stable_id": "telemetry.ocsf.api_activity@v1",
  "content_version": "0.1.0",
  "maturity": "experimental",
  "title": "API Activity event (paging-system page dispatch + responder acknowledgement)",
  "summary": "OCSF API Activity events the on-call-rotation playbook reads to observe page dispatch along the bound escalation chain and the first responder acknowledgement returned by the operator's paging system. The same class carries handoff-brief delivery confirmation events emitted by the bound delivery channel (paging-system DM, chat thread, email gateway) so the delivery-SLA KPI can resolve deliver-time independently of compose-time.",
  "ocsf": {
    "version": "1.3.0",
    "category_uid": 6,
    "category_name": "Application Activity",
    "class_uid": 6003,
    "class_name": "API Activity"
  },
  "direction": "both",
  "fields_used": [
    "time",
    "activity_id",
    "actor.user.uid",
    "api.operation",
    "api.request.uid",
    "api.response.code",
    "src_endpoint.ip",
    "status_id"
  ],
  "control_refs": [
    "control.on_call_roster_governance@v1"
  ],
  "playbook_refs": [
    {
      "playbook_id": "playbook.on_call_rotation@v1",
      "step_id": "action--30000000-0000-4000-8000-000000000003"
    },
    {
      "playbook_id": "playbook.on_call_rotation@v1",
      "step_id": "action--30000000-0000-4000-8000-000000000005"
    },
    {
      "playbook_id": "playbook.on_call_rotation@v1",
      "step_id": "action--30000000-0000-4000-8000-000000000006"
    }
  ],
  "maintainer": "telemetry-wg@secops-ng.org"
}
