{
  "stable_id": "telemetry.ocsf.incident_finding@v1",
  "content_version": "0.1.0",
  "maturity": "experimental",
  "title": "Incident finding event (emit)",
  "summary": "Structured incident finding emitted by the data_exfil playbook's notification steps. Bound to OCSF Incident Finding so downstream regulators, customers, and dashboards consume a single shape regardless of which channel the compile target ships the notification along.",
  "ocsf": {
    "version": "1.3.0",
    "category_uid": 2,
    "category_name": "Findings",
    "class_uid": 2005,
    "class_name": "Incident Finding"
  },
  "direction": "emit",
  "fields_used": [
    "time",
    "activity_id",
    "severity_id",
    "incident.uid",
    "incident.status",
    "incident.priority",
    "finding_info.title",
    "finding_info.desc",
    "impact.total_count"
  ],
  "control_refs": [
    "control.dlp_enforcement@v1"
  ],
  "playbook_refs": [
    {
      "playbook_id": "playbook.data_exfil@v1",
      "step_id": "notify_regulator"
    },
    {
      "playbook_id": "playbook.data_exfil@v1",
      "step_id": "notify_customer"
    }
  ],
  "maintainer": "telemetry-wg@secops-ng.org"
}
